Code,Definition,Structure,Measure,Stat,role,taxon,Reference,Note,Source Note
FrontalLobe,size-corrected surface dimension of the frontal lobe (endocast surface),FrontalLobe,size.corrected.surface,Mean,secondary,Homo,Balzeau_etal_2012_Table3,relative/allometric measure (not an absolute surface or volume); not merged into __merging_volumes,snapshot row 'Frontal lobes'
Parieto-TemporalLobe,size-corrected surface dimension of the parieto-temporal lobe (endocast surface),Parieto-TemporalLobe,size.corrected.surface,Mean,secondary,Homo,Balzeau_etal_2012_Table3,relative/allometric measure (not an absolute surface or volume); not merged into __merging_volumes,snapshot row 'Parieto-temporal lobes'
OccipitalLobe,size-corrected surface dimension of the occipital lobe (endocast surface),OccipitalLobe,size.corrected.surface,Mean,secondary,Homo,Balzeau_etal_2012_Table3,relative/allometric measure (not an absolute surface or volume); not merged into __merging_volumes,snapshot row 'Occipital lobes'
Sample,analysed Homo sample,,,,info,Homo,Balzeau_etal_2012_Table3,"levels: Homo habilis s.l.; African and Georgian Homo erectus s.l.; Asian Homo erectus; Neandertals s.l.; AMH (anatomically modern Homo sapiens)",
Structure_Balzeau2012,lobe name exactly as printed in Table 3,,,,info,Homo,Balzeau_etal_2012_Table3,preserved printed structure name,
n,number of specimens contributing to the sample x lobe cell,,,n,primary,Homo,Balzeau_etal_2012_Table3,varies by lobe within a sample (e.g. Asian H. erectus: 15 frontal / 14 parieto-temporal / 16 occipital),snapshot columns 'n'
Mean_surface_sizecorrected,mean size-corrected surface dimension of the lobe,,size.corrected.surface,Mean,secondary,Homo,Balzeau_etal_2012_Table3,dimensionless index (allometrically size-corrected); see paper Methods for the correction,snapshot columns 'Mean'
V_star,size-corrected coefficient of variation of the lobe surface,,size.corrected.surface,V*,secondary,Homo,Balzeau_etal_2012_Table3,sample size-corrected CV (V*) as defined in the paper,snapshot columns 'V*'
Method:size-correction,"surfaces of frontal, parieto-temporal and occipital lobes were size-corrected (adjusted for overall endocast size) before comparison",,,,method,,Balzeau_etal_2012_Table3,see Balzeau et al. 2012 Materials and Methods; regression parameters for surface vs endocranial volume are in the paper's Table 2,
