Code,Definition,Structure,Measure,Stat,role,taxon,Reference,Note,Source Note
Species,species name as printed in the paper,,,info,,,Frahm_etal_1998_Table1,taxonomy applied later via ../_keys/Stephan/,
n,number of specimens,,,n,primary,Insectivora & Primates,Frahm_etal_1998_Table1,,
Middle_temporal_visual_area_mm3,Middle temporal visual area (Vol.mm3),Middle_temporal_visual_area,Vol.mm3,,primary,Insectivora & Primates,Frahm_etal_1998_Table1,from comparison CSV column Middle_temporal_visual_area,
Area_striata_grey_matter_mm3,Area striata grey matter (Vol.mm3),Area_striata_grey_matter,Vol.mm3,,primary,Insectivora & Primates,Frahm_etal_1998_Table1,from comparison CSV column Area_striata_grey_matter_1998,
Corpus_geniculatum_laterale_mm3,Corpus geniculatum laterale (Vol.mm3),Corpus_geniculatum_laterale,Vol.mm3,,primary,Insectivora & Primates,Frahm_etal_1998_Table1,from comparison CSV column Corpus_geniculatum_laterale_1998,
body_weight_g,Body weight (Mass.g),Body_weight,Mass.g,,secondary,Insectivora & Primates,Frahm_etal_1998_Table1,from comparison CSV column Body_weight_1998,
brain_weight_mg,Brain weight (Mass.mg),Brain_weight,Mass.mg,,secondary,Insectivora & Primates,Frahm_etal_1998_Table1,from comparison CSV column Brain_weight_1998,
